{
  "kind": "cineweave_codex_control_channel_set",
  "contractVersion": "2.0.0",
  "worldId": "world-cloud-dynasty",
  "controlSetId": "controls.shen-expression-sheet",
  "title": "沈砚秋定妆九宫格控制通道",
  "version": 1,
  "status": "active",
  "skillReceipt": {
    "repository": "https://github.com/Wilder1222/cineweave-director",
    "ref": "v3.1.0",
    "commit": "0123456789abcdef0123456789abcdef01234567",
    "contentHash": "sha256:aaaaaaaaaaaaaaaaaaaaaaaaaaaaaaaaaaaaaaaaaaaaaaaaaaaaaaaaaaaaaaaa",
    "installedBy": "codex-environment",
    "usedAt": "2026-08-20T18:00:00.000Z"
  },
  "purpose": "锁定人物身份、造型、机位、背景和光照，只允许每格表情状态变化。",
  "channels": [
    {
      "channelId": "control.identity.face",
      "target": {
        "scope": "character_identity",
        "fieldPath": "characterSpec.identityCore.face",
        "subjectRef": "char.shen-yanqiu@1"
      },
      "enforcement": "hard",
      "priority": 1000,
      "source": {
        "type": "character_spec",
        "ref": "char.shen-yanqiu",
        "version": 1,
        "contentHash": "sha256:bbbbbbbbbbbbbbbbbbbbbbbbbbbbbbbbbbbbbbbbbbbbbbbbbbbbbbbbbbbbbbbb"
      },
      "preserve": [
        "脸型、眼型、鼻唇结构和自然不对称"
      ],
      "allowedDeviation": [
        "仅允许表情引起的自然软组织变化"
      ],
      "adapterRequirements": [
        "face_identity",
        "multi_reference"
      ],
      "fallback": {
        "action": "block",
        "message": "无法解析身份参考时不得生成九宫格。"
      },
      "conflictGroup": "character_identity",
      "rationale": "定妆表的首要目的是真实锁定同一人物。"
    },
    {
      "channelId": "control.body.rhythm",
      "target": {
        "scope": "character_body",
        "fieldPath": "characterSpec.identityCore.body",
        "subjectRef": "char.shen-yanqiu@1"
      },
      "enforcement": "hard",
      "priority": 950,
      "source": {
        "type": "character_spec",
        "ref": "char.shen-yanqiu",
        "version": 1,
        "contentHash": "sha256:bbbbbbbbbbbbbbbbbbbbbbbbbbbbbbbbbbbbbbbbbbbbbbbbbbbbbbbbbbbbbbbb"
      },
      "preserve": [
        "肩颈比例、头身节奏和惯用侧"
      ],
      "allowedDeviation": [
        "胸像裁切允许不可见下肢"
      ],
      "adapterRequirements": [
        "full_body_identity"
      ],
      "fallback": {
        "action": "block",
        "message": "身体身份证据不足时不得把表情表升级为全身资产。"
      },
      "conflictGroup": "character_identity",
      "rationale": "避免不同格子出现年龄或体型漂移。"
    },
    {
      "channelId": "control.appearance.lock",
      "target": {
        "scope": "costume",
        "fieldPath": "appearanceState",
        "subjectRef": "appearance.shen-duty@1"
      },
      "enforcement": "hard",
      "priority": 900,
      "source": {
        "type": "appearance_state",
        "ref": "appearance.shen-duty",
        "version": 1,
        "contentHash": "sha256:cccccccccccccccccccccccccccccccccccccccccccccccccccccccccccccccc"
      },
      "preserve": [
        "妆容、发型、服装、饰品和材质状态"
      ],
      "allowedDeviation": [
        "发丝可因微表情产生极小位移"
      ],
      "adapterRequirements": [
        "multi_reference"
      ],
      "fallback": {
        "action": "block",
        "message": "造型状态未锁定时不得拼版。"
      },
      "conflictGroup": "appearance",
      "rationale": "表情比较必须在同一造型条件下进行。"
    },
    {
      "channelId": "control.expression.delta",
      "target": {
        "scope": "expression",
        "fieldPath": "characterBinding.performanceState",
        "subjectRef": "char.shen-yanqiu@1"
      },
      "enforcement": "soft",
      "priority": 700,
      "source": {
        "type": "asset_recipe",
        "ref": "recipe.character-expression-sheet-3x3",
        "version": 1,
        "contentHash": "sha256:eeeeeeeeeeeeeeeeeeeeeeeeeeeeeeeeeeeeeeeeeeeeeeeeeeeeeeeeeeeeeeee"
      },
      "preserve": [
        "每格指定情绪、强度与隐藏程度"
      ],
      "allowedDeviation": [
        "允许自然微表情差异，但不得改变身份"
      ],
      "adapterRequirements": [
        "expression_control"
      ],
      "fallback": {
        "action": "warn",
        "message": "表情控制仅部分支持时必须逐格人工审核。"
      },
      "conflictGroup": "performance",
      "rationale": "九宫格只改变表情这一主变量。"
    },
    {
      "channelId": "control.camera.lock",
      "target": {
        "scope": "camera",
        "fieldPath": "recipe.layout.cameraConsistency"
      },
      "enforcement": "hard",
      "priority": 850,
      "source": {
        "type": "asset_recipe",
        "ref": "recipe.character-expression-sheet-3x3",
        "version": 1,
        "contentHash": "sha256:eeeeeeeeeeeeeeeeeeeeeeeeeeeeeeeeeeeeeeeeeeeeeeeeeeeeeeeeeeeeeeee"
      },
      "preserve": [
        "镜头距离、角度、焦段和裁切一致"
      ],
      "adapterRequirements": [],
      "fallback": {
        "action": "block",
        "message": "机位不一致时不得进入最终拼版。"
      },
      "conflictGroup": "layout",
      "rationale": "统一机位使表情差异可比较。"
    },
    {
      "channelId": "control.style.advisory",
      "target": {
        "scope": "style",
        "fieldPath": "prompt.style"
      },
      "enforcement": "advisory",
      "priority": 100,
      "source": {
        "type": "human_instruction",
        "ref": "restrained-live-action-realism"
      },
      "preserve": [
        "克制写实，不使用夸张动漫变形"
      ],
      "adapterRequirements": [],
      "fallback": {
        "action": "degrade",
        "message": "风格可以弱化，但不能覆盖身份和表演控制。"
      },
      "conflictGroup": "style",
      "rationale": "风格是低优先级视觉语法。"
    }
  ],
  "conflictResolution": {
    "order": [
      "world_canon",
      "character_identity",
      "appearance",
      "performance",
      "layout",
      "style"
    ],
    "tieBreak": "block",
    "lowerPriorityCannotOverrideHard": true
  },
  "validation": {
    "sourcesResolved": true,
    "uniqueChannelIds": true,
    "providerNeutral": true,
    "hardChannelsBlockOnFailure": true
  },
  "provenance": {
    "source": "codex_authored",
    "createdAt": "2026-08-20T18:00:00.000Z",
    "updatedAt": "2026-08-20T18:00:00.000Z",
    "changeLog": [
      "v1: define expression-sheet control precedence"
    ]
  }
}
